
<!ENTITY  nbsp         "&#xA0;" >
<!ENTITY  mdash        "&#xA0;- " >


<!ELEMENT change_log   (changes)* >
<!ATTLIST change_log   title  CDATA #REQUIRED >

<!ELEMENT changes      (change)* >
<!ATTLIST changes      ver      CDATA #REQUIRED
                       rev      CDATA #REQUIRED
                       date     CDATA #REQUIRED
                       time     CDATA #REQUIRED
                       packager CDATA #REQUIRED
                       apply    CDATA #REQUIRED
>

<!ELEMENT change       (para)* >
<!ATTLIST change       type (bugfix | feature | change | security | workaround) #IMPLIED >

<!ELEMENT para         (#PCDATA | at | br | nobr)* >

<!ELEMENT at           EMPTY >
<!ELEMENT br           EMPTY >
<!ELEMENT nobr         (#PCDATA) >
